{
  "record_metadata": {
    "schema_version": "1.0.0",
    "opc_id": "example_hybrid_arable_opc",
    "created_by": "MARVIC template demonstration",
    "last_updated": "2026-03-15",
    "notes": "Illustrative example only."
  },
  "factsheet": {
    "opc_name": "Example Hybrid Arable OPC",
    "opc_fullname": "Example Hybrid Arable Observation and Processing Chain",
    "lead_institutions": ["Example Research Institute", "Example University"],
    "main_modelling_approach": "hybrid",
    "target_lusts": ["arable land", "cropland on mineral soils"],
    "geographic_focus": ["Finland", "Northern Europe"],
    "ghgs_covered": ["SOC", "CO2", "N2O"],
    "reporting_scale": ["parcel", "farm", "project"],
    "update_frequency": "annual",
    "user_orientation": ["research", "operational_MRV", "advisory"],
    "operational_maturity": "03_pilot",
    "openness_level": "partly_open",
    "validation_status": "validated_limited_domain",
    "validation_status_notes": "Validated mainly for arable mineral soils under temperate-boreal conditions."
  },
  "models": [
    {
      "model_name": "Example Productivity Model",
      "model_role": "upstream",
      "model_version": "2.1.0",
      "model_repository": "https://example.org/repos/example-productivity-model",
      "scientific_publication_dois": ["10.1234/example.productivity.2024"],
      "notes": "Used to estimate biomass-related carbon inputs."
    },
    {
      "model_name": "Example Soil Carbon Model",
      "model_role": "core",
      "model_version": "1.4.3",
      "model_repository": "https://example.org/repos/example-soil-model",
      "scientific_publication_dois": [
        "10.2345/example.soilmodel.2022",
        "10.3456/example.calibration.2025"
      ],
      "notes": "Receives carbon-input estimates from upstream module."
    }
  ],
  "uncertainty_propagation": {
    "initial_conditions": {
      "propagated": true,
      "propagation_method": "State initialization uncertainty sampled from prior distributions informed by baseline SOC data."
    },
    "drivers": {
      "propagated": true,
      "propagation_method": "Weather and management inputs sampled from reported or assumed uncertainty distributions."
    },
    "parameters": {
      "propagated": true,
      "propagation_method": "Posterior parameter samples from Bayesian calibration."
    },
    "management": {
      "propagated": false,
      "propagation_method": ""
    },
    "process_error": {
      "propagated": true,
      "propagation_method": "Residual dynamic uncertainty added as time-evolving stochastic term."
    },
    "random_effects": {
      "propagated": false,
      "propagation_method": "Documented qualitatively; not yet explicitly propagated."
    },
    "project_scale": true
  },
  "validation_evidence_overview": [
    {
      "variable_validated": "delta SOC",
      "dataset_type": "benchmark site and on-farm monitoring",
      "geography": "Finland",
      "period": "2016-2025",
      "validation_metrics": [
        "RMSE",
        "bias",
        "90_percent_prediction_interval_coverage"
      ],
      "summary_result": "Performance acceptable for annual to multi-annual SOC change estimation in arable mineral soils under current test conditions.",
      "remaining_gap": "Limited validation in peat soils, permanent grassland, and highly heterogeneous management systems."
    },
    {
      "variable_validated": "yield",
      "dataset_type": "farmer records cross-checked with independent farm sample",
      "geography": "Northern Europe",
      "period": "2020-2025",
      "validation_metrics": ["MAE", "R2"],
      "summary_result": "Yield estimates are adequate for use as one driver of carbon input estimation, with performance varying by crop type.",
      "remaining_gap": "Sparse independent evidence for mixed rotations and cover-crop systems."
    }
  ],
  "crcf_model_readiness_matrix": {
    "assessment_unit": "OPC",
    "applies_to_model_name": "",
    "eligibility_pathway": {
      "national_inventory_model": false,
      "commission_compliant_model": true
    },
    "model_compliance_criteria": {
      "transparency_traceability": {
        "status": "partly_met",
        "short_justification": "Versions are documented, but some code and parameter sets are not fully open.",
        "priority_for_improvement": "high",
        "evidence_notes": "Repository links exist, but release notes and full parameter provenance are incomplete."
      },
      "scientific_credibility": {
        "status": "met",
        "short_justification": "The OPC is based on peer-reviewed modelling components and published calibration work.",
        "priority_for_improvement": "medium",
        "evidence_notes": "Peer-reviewed references available for both the productivity and soil modules."
      },
      "suitability": {
        "status": "partly_met",
        "short_justification": "Calibration and validation evidence exists for some but not all intended pedoclimatic and management conditions.",
        "priority_for_improvement": "high",
        "evidence_notes": "Evidence strongest in arable mineral soils; weaker in peat soils and highly heterogeneous systems."
      },
      "minimum_accuracy": {
        "status": "unclear",
        "short_justification": "Several performance metrics are available, but alignment with the required minimum-accuracy framing is not yet fully demonstrated.",
        "priority_for_improvement": "critical",
        "evidence_notes": "Prediction-interval coverage and PMU-aligned comparisons need clearer reporting.",
        "bias": false,
        "pi": false,
        "r2": false
      }
    }
  }
}
